company,link,title,date_,publisher_,source_type_
Aurrigo,https://www.proquest.com/anznews/docview/1964172105/4FB84235481A4115PQ/4?accountid=14649,DRIVERLESS SHUTTLE IN RUNNING FOR XMAS LAUNCH,"Nov 16, 2017",Nationwide News Pty Ltd,Newspaper
Aurrigo,https://www.proquest.com/anznews/docview/2032731465/4FB84235481A4115PQ/5?accountid=14649,TAKE A CHANCE ON ME,"Apr 28, 2018",Nationwide News Pty Ltd,Newspaper
Aurrigo,https://www.proquest.com/anznews/docview/1963148895/4FB84235481A4115PQ/6?accountid=14649,People with drive create cars without drivers,"Nov 14, 2017",Nationwide News Pty Ltd,Newspaper
Aurrigo,https://www.proquest.com/anznews/docview/1963148318/4FB84235481A4115PQ/7?accountid=14649,Innovation in driver’s seat,"Nov 14, 2017",Nationwide News Pty Ltd,Newspaper
Aurrigo,https://www.proquest.com/anznews/docview/2214390653/4FB84235481A4115PQ/8?accountid=14649,Driverless vehicle trial given the green light,"Apr 26, 2019",Fairfax Media Publications Pty Limited,Newspaper
Aurrigo,https://www.proquest.com/anznews/docview/1963149952/4FB84235481A4115PQ/9?accountid=14649,Innovation in driver’s seat,"Nov 14, 2017",Nationwide News Pty Ltd,Newspaper
Aurrigo,https://www.proquest.com/anznews/docview/1983251217/4FB84235481A4115PQ/10?accountid=14649,DRIVERLESS IS COMING FAST: cover story Mooloolaba hosts trial of autonomous shuttle ... albeit at 7km/h,"Dec 20, 2017",Nationwide News Pty Ltd,Newspaper
Aurrigo,https://www.proquest.com/anznews/docview/1979098266/4FB84235481A4115PQ/11?accountid=14649,DRIVERLESS IS COMING FAST: cover story Mooloolaba hosts trial of autonomous shuttle ... albeit at 7km/h,"Dec 22, 2017",Nationwide News Pty Ltd,Newspaper
Aurrigo,https://www.proquest.com/anznews/docview/1983249952/4FB84235481A4115PQ/12?accountid=14649,DRIVERLESS IS COMING FAST: cover story Mooloolaba hosts trial of autonomous shuttle ... albeit at 7km/h,"Dec 16, 2017",Nationwide News Pty Ltd,Newspaper
Aurrigo,https://www.proquest.com/anznews/docview/1964172659/4FB84235481A4115PQ/13?accountid=14649,"Look, no hands: driverless cars hit road","Nov 16, 2017",Nationwide News Pty Ltd,Newspaper
Aurrigo,https://www.proquest.com/anznews/docview/2077526976/4FB84235481A4115PQ/14?accountid=14649,Uni’s big push for electric car hub,"Jul 29, 2018",Nationwide News Pty Ltd,Newspaper
Australian Permanent Visas,https://www.proquest.com/anznews/docview/2596912566/C674E674AFAE4C71PQ/1?accountid=14649,Family’s tortuous path from Kabul horror to haven,"Nov 12, 2021",Nationwide News Pty Ltd,Newspaper
Australian Permanent Visas,https://www.proquest.com/anznews/docview/2596786574/C674E674AFAE4C71PQ/2?accountid=14649,Family’s tortuous path from horror to haven,"Nov 13, 2021",Nationwide News Pty Ltd,Newspaper
Azzo,https://www.proquest.com/anznews/docview/2451684359/101F59A77B48425BPQ/1?accountid=14649,Fashion week back in business,"Oct 19, 2020",Nationwide News Pty Ltd,Newspaper
Azzo,https://www.proquest.com/anznews/docview/2543569160/101F59A77B48425BPQ/2?accountid=14649,A Nice move at Tonsley,"Jun 22, 2021",Nationwide News Pty Ltd,Newspaper
Azzo,https://www.proquest.com/anznews/docview/354813540/101F59A77B48425BPQ/3?accountid=14649,Detailed energy use now on tap,"Jan 19, 2010",Nationwide News Pty Ltd,Newspaper
Azzo,https://www.proquest.com/anznews/docview/890076169/101F59A77B48425BPQ/4?accountid=14649,Success builds on car plant skills,"Sep 17, 2011",Nationwide News Pty Ltd,Newspaper
Azzo,https://www.proquest.com/anznews/docview/2232513739/101F59A77B48425BPQ/5?accountid=14649,Abs-olutely cut on the runway,"May 16, 2019",Nationwide News Pty Ltd,Newspaper
Azzo,https://www.proquest.com/anznews/docview/2227914126/101F59A77B48425BPQ/6?accountid=14649,Hot catwalk looks to make next summer a real sizzler,"May 22, 2019",Nationwide News Pty Ltd,Newspaper
Azzo,https://www.proquest.com/anznews/docview/1978327718/101F59A77B48425BPQ/7?accountid=14649,"Dressed for success, at home and abroad","Dec 20, 2017",Nationwide News Pty Ltd,Newspaper
Azzo,https://www.proquest.com/anznews/docview/1835097292/101F59A77B48425BPQ/8?accountid=14649,Sport listings,"Nov 3, 2016",Fairfax Media Publications Pty Limited,Newspaper
Azzo,https://www.proquest.com/anznews/docview/1027725134/101F59A77B48425BPQ/9?accountid=14649,Cool prize for green device,"Jul 26, 2012",Nationwide News Pty Ltd,Newspaper
Azzo,https://www.proquest.com/anznews/docview/354738118/101F59A77B48425BPQ/10?accountid=14649,CleverGreen Innovators to Watch Awards,"Feb 2, 2010",Nationwide News Pty Ltd,Newspaper
Azzo,https://www.proquest.com/anznews/docview/2315986019/101F59A77B48425BPQ/11?accountid=14649,SA Produce Market’s $10.5m powerful move,"Nov 21, 2019",Nationwide News Pty Ltd,Newspaper
Azzo,https://www.proquest.com/anznews/docview/354730346/101F59A77B48425BPQ/12?accountid=14649,Green-savvy firms clean up,"Feb 17, 2010",Nationwide News Pty Ltd,Newspaper
Azzo,https://www.proquest.com/anznews/docview/354780363/101F59A77B48425BPQ/13?accountid=14649,Smart device cuts energy and costs,"Dec 8, 2009",Nationwide News Pty Ltd,Newspaper
Azzo,https://www.proquest.com/anznews/docview/1530215491/101F59A77B48425BPQ/14?accountid=14649,"No early swan song, says Mick","May 30, 2014",Nationwide News Pty Ltd,Newspaper
Benjamin Dragovelic,https://www.proquest.com/anznews/docview/1744670375/7D3A4ECC279D4581PQ/1?accountid=14649,STREET TALK What is your favourite Taylor Swift song?,"Dec 8, 2015",Nationwide News Pty Ltd,Newspaper
Briefing Room,https://www.proquest.com/anznews/docview/2650960437/8534190693CE4CD4PQ/1?accountid=14649,Wingecarribee Shire Council public inquiry: Peter Nelson and Ken Halstead talk inappropriate communication,"Apr 16, 2022",Nationwide News Pty Ltd,Newspaper
Briefing Room,https://www.proquest.com/anznews/docview/2674108669/8534190693CE4CD4PQ/2?accountid=14649,STAR’S TEARS FOR THE LOST CHILDREN,"Jun 9, 2022",Nationwide News Pty Ltd,Newspaper
Briefing Room,https://www.proquest.com/anznews/docview/2674107347/8534190693CE4CD4PQ/3?accountid=14649,STAR’S TEARS FOR THE LOST CHILDREN,"Jun 9, 2022",Nationwide News Pty Ltd,Newspaper
Briefing Room,https://www.proquest.com/anznews/docview/2428688618/8534190693CE4CD4PQ/4?accountid=14649,Crows fans need to demand more,"Jul 31, 2020",Nationwide News Pty Ltd,Newspaper
Briefing Room,https://www.proquest.com/anznews/docview/2428688561/8534190693CE4CD4PQ/5?accountid=14649,Crows fans need to demand more,"Jul 31, 2020",Nationwide News Pty Ltd,Newspaper
Briefing Room,https://www.proquest.com/anznews/docview/2432654143/8534190693CE4CD4PQ/6?accountid=14649,HOUSE OF FEAR,"Aug 12, 2020",Nationwide News Pty Ltd,Newspaper
Briefing Room,https://www.proquest.com/anznews/docview/1764721727/8534190693CE4CD4PQ/7?accountid=14649,REALITY BITES,"Feb 13, 2016",Nationwide News Pty Ltd,Newspaper
Briefing Room,https://www.proquest.com/anznews/docview/354985150/8534190693CE4CD4PQ/8?accountid=14649,SUPPORT U.S. ready to boost aid,"May 7, 2008",Nationwide News Pty Ltd,Newspaper
Briefing Room,https://www.proquest.com/anznews/docview/1719884213/8534190693CE4CD4PQ/9?accountid=14649,WORLD-FIRST COFFEE CUP What the Feds rate higher than new tower,"Oct 9, 2015",Nationwide News Pty Ltd,Newspaper
Briefing Room,https://www.proquest.com/anznews/docview/1706052790/8534190693CE4CD4PQ/10?accountid=14649,Hawks happy to travel west,"Aug 23, 2015",Nationwide News Pty Ltd,Newspaper
Briefing Room,https://www.proquest.com/anznews/docview/1705974173/8534190693CE4CD4PQ/11?accountid=14649,Hawks happy to travel west if necessary,"Aug 23, 2015",Nationwide News Pty Ltd,Newspaper
Briefing Room,https://www.proquest.com/anznews/docview/355443704/8534190693CE4CD4PQ/12?accountid=14649,"[Selected items from The Advertiser, published during the past 100 years]: [1 State Edition]","Dec 5, 2005",Nationwide News Pty Ltd,Newspaper
Briefing Room,https://www.proquest.com/anznews/docview/1498093390/8534190693CE4CD4PQ/13?accountid=14649,"Hawthon, we have a problem: INSIDE FOOTBALL - Football","Feb 15, 2014",Fairfax Digital,Newspaper
Briefing Room,https://www.proquest.com/anznews/docview/2058465683/8534190693CE4CD4PQ/14?accountid=14649,SPACE THE FINAL FRONTIER,"Jun 23, 2018",Nationwide News Pty Ltd,Newspaper
Briefing Room,https://www.proquest.com/anznews/docview/363918848/8534190693CE4CD4PQ/15?accountid=14649,Secret life of an endangered species comes to light in zoo deal with China; APEC in Australia - THE TWO PANDAS: [First Edition],"Sep 7, 2007",Fairfax Digital,Newspaper
Briefing Room,https://www.proquest.com/anznews/docview/1805819653/8534190693CE4CD4PQ/16?accountid=14649,A giant leap for space school,"Jul 22, 2016",Nationwide News Pty Ltd,Newspaper
Briefing Room,https://www.proquest.com/anznews/docview/1943154831/8534190693CE4CD4PQ/17?accountid=14649,SA’s new red planet is out of this world,"Sep 28, 2017",Nationwide News Pty Ltd,Newspaper
Briefing Room,https://www.proquest.com/anznews/docview/1918611666/8534190693CE4CD4PQ/18?accountid=14649,It’s a bawdy force as another official is embroiled in scandal,"Jul 14, 2017",Nationwide News Pty Ltd,Newspaper
Briefing Room,https://www.proquest.com/anznews/docview/354908333/8534190693CE4CD4PQ/19?accountid=14649,UNITED STATES Bush press aide dies,"Jul 14, 2008",Nationwide News Pty Ltd,Newspaper
Briefing Room,https://www.proquest.com/anznews/docview/1322353121/8534190693CE4CD4PQ/20?accountid=14649,"Just kidding, it's Kid President","Apr 3, 2013",Nationwide News Pty Ltd,Newspaper
Briefing Room,https://www.proquest.com/anznews/docview/1710035114/8534190693CE4CD4PQ/21?accountid=14649,Family fun takes a trip to dark side,"Sep 9, 2015",Nationwide News Pty Ltd,Newspaper
Briefing Room,https://www.proquest.com/anznews/docview/1943150865/8534190693CE4CD4PQ/22?accountid=14649,SA’s new red planet is out of this world,"Sep 28, 2017",Nationwide News Pty Ltd,Newspaper
Briefing Room,https://www.proquest.com/anznews/docview/1922288877/8534190693CE4CD4PQ/23?accountid=14649,Trump’s new mouthpiece consigns his remarks to history,"Jul 24, 2017",Nationwide News Pty Ltd,Newspaper
Briefing Room,https://www.proquest.com/anznews/docview/1922289468/8534190693CE4CD4PQ/24?accountid=14649,Trump’s new mouthpiece consigns his remarks to history,"Jul 24, 2017",Nationwide News Pty Ltd,Newspaper
Briefing Room,https://www.proquest.com/anznews/docview/355732426/8534190693CE4CD4PQ/25?accountid=14649,"The Advertiser EDITORIALThey serve with pride, let's recognise them: [1 State Edition]","Mar 22, 2003",Nationwide News Pty Ltd,Newspaper
Briefing Room,https://www.proquest.com/anznews/docview/1002431036/8534190693CE4CD4PQ/26?accountid=14649,"'She said they were really tight ... they hurt her wrists' US police handcuff girl, 6, for tantrum","Apr 19, 2012",Nationwide News Pty Ltd,Newspaper
Briefing Room,https://www.proquest.com/anznews/docview/2161689621/8534190693CE4CD4PQ/27?accountid=14649,Without a clue,"Dec 30, 2018",Nationwide News Pty Ltd,Newspaper
Briefing Room,https://www.proquest.com/anznews/docview/356067230/8534190693CE4CD4PQ/28?accountid=14649,Behind the lines: [1 STATE Edition],"Sep 29, 2001",Nationwide News Pty Ltd,Newspaper
Briefing Room,https://www.proquest.com/anznews/docview/1800726648/8534190693CE4CD4PQ/29?accountid=14649,Dumb and dumber: The undoing of Dodger,"Jun 18, 2016",Nationwide News Pty Ltd,Newspaper
Briefing Room,https://www.proquest.com/anznews/docview/1706251533/8534190693CE4CD4PQ/30?accountid=14649,"I nterstate travel won't be problem for Hawks, says Roughead","Aug 23, 2015",Nationwide News Pty Ltd,Newspaper
Briefing Room,https://www.proquest.com/anznews/docview/2395490641/8534190693CE4CD4PQ/31?accountid=14649,It was an Anzac Day Australians will always remember,"Apr 29, 2020",Fairfax Media Publications Pty Limited,Newspaper
Briefing Room,https://www.proquest.com/anznews/docview/2395490529/8534190693CE4CD4PQ/32?accountid=14649,It was an Anzac Day Australians will always remember,"Apr 29, 2020",Fairfax Media Publications Pty Limited,Newspaper
Briefing Room,https://www.proquest.com/anznews/docview/363696093/8534190693CE4CD4PQ/33?accountid=14649,At the apex; Cover story: [Late Edition],"Mar 10, 2000",Fairfax Digital,Newspaper
Briefing Room,https://www.proquest.com/anznews/docview/356203842/8534190693CE4CD4PQ/34?accountid=14649,Death by misadventure,"Jul 12, 2008",News Limited,Newspaper
Business Foundations,https://www.proquest.com/anznews/docview/2428190636/B8E43FA99A3E4908PQ/1?accountid=14649,Studying is a case of horse business,"Jul 30, 2020",Fairfax Media Publications Pty Limited,Newspaper
Business Foundations,https://www.proquest.com/anznews/docview/2461035042/B8E43FA99A3E4908PQ/2?accountid=14649,Elders records profit lift of 80pc to $123m,"Nov 18, 2020",Fairfax Media Publications Pty Limited,Newspaper
Business Foundations,https://www.proquest.com/anznews/docview/2461640759/B8E43FA99A3E4908PQ/3?accountid=14649,"Despite testing times, Elders lifts profit 80pc","Nov 19, 2020",Fairfax Media Publications Pty Limited,Newspaper
Business Foundations,https://www.proquest.com/anznews/docview/2460860570/B8E43FA99A3E4908PQ/4?accountid=14649,Elders posts decade-best financial results,"Nov 17, 2020",Nationwide News Pty Ltd,Newspaper
Business Foundations,https://www.proquest.com/anznews/docview/1703457811/B8E43FA99A3E4908PQ/5?accountid=14649,Business foundations never change,"Aug 13, 2015",Fairfax Media Publications Pty Limited,Newspaper
Business Foundations,https://www.proquest.com/anznews/docview/355193068/B8E43FA99A3E4908PQ/6?accountid=14649,NATIONAL FOODS It all started in Jamestown Japan buys our iconic farm brands: [1 State Edition],"Nov 9, 2007",Nationwide News Pty Ltd,Newspaper
Business Foundations,https://www.proquest.com/anznews/docview/2190160439/B8E43FA99A3E4908PQ/7?accountid=14649,Industry Leaders Fund delivers SA jobs bonanza,"Mar 13, 2019",Nationwide News Pty Ltd,Newspaper
Business Foundations,https://www.proquest.com/anznews/docview/2111166376/B8E43FA99A3E4908PQ/8?accountid=14649,New crop of SA leaders ready to fast-track growth,"Sep 25, 2018",Nationwide News Pty Ltd,Newspaper
Business Foundations,https://www.proquest.com/anznews/docview/878958191/B8E43FA99A3E4908PQ/9?accountid=14649,Prison that sets small businesses free,"Jul 26, 2011",Seven West Media,Newspaper
Business Foundations,https://www.proquest.com/anznews/docview/376828081/B8E43FA99A3E4908PQ/10?accountid=14649,Positive outlook for banks: [1 Edition],"Nov 5, 2004",Nationwide News Pty Ltd,Newspaper
Business Foundations,https://www.proquest.com/anznews/docview/355610070/B8E43FA99A3E4908PQ/11?accountid=14649,Accounting merger: [1 State Edition],"Apr 13, 2004",Nationwide News Pty Ltd,Newspaper
Business Foundations,https://www.proquest.com/anznews/docview/363480974/B8E43FA99A3E4908PQ/12?accountid=14649,South secures new sponsor; SOCCER: [Late Edition],"Nov 10, 2000",Fairfax Digital,Newspaper
Business Foundations,https://www.proquest.com/anznews/docview/2404084099/B8E43FA99A3E4908PQ/13?accountid=14649,Livestock prices aid Elders result,"May 19, 2020",Nationwide News Pty Ltd,Newspaper
Business Foundations,https://www.proquest.com/anznews/docview/355551502/B8E43FA99A3E4908PQ/14?accountid=14649,"A feast or a famine, entirely up to you: [1 State Edition]","Feb 22, 2005",Nationwide News Pty Ltd,Newspaper
Business Foundations,https://www.proquest.com/anznews/docview/1086943302/B8E43FA99A3E4908PQ/15?accountid=14649,YOUR BUSINESS Incubate for growth,"Oct 8, 2012",Nationwide News Pty Ltd,Newspaper
Business Foundations,https://www.proquest.com/anznews/docview/816083529/B8E43FA99A3E4908PQ/16?accountid=14649,Plans afoot to turn corner,"Dec 7, 2010",Seven West Media,Newspaper
CareApp,https://www.proquest.com/anznews/docview/2628376935/257FBCCED6094396PQ/1?accountid=14649,"Amid Covid chaos, start-ups get timely booster","Feb 15, 2022",Nationwide News Pty Ltd,Newspaper
CareApp,https://www.proquest.com/anznews/docview/2540599966/257FBCCED6094396PQ/2?accountid=14649,French tech billionaire Xavier Niel’s 42 launches in Adelaide via KIK Innovation’s Louise Nobes,"Jun 14, 2021",Nationwide News Pty Ltd,Newspaper
CareApp,https://www.proquest.com/anznews/docview/2434600254/257FBCCED6094396PQ/3?accountid=14649,Funding to expand a network of care in SA,"Aug 18, 2020",Nationwide News Pty Ltd,Newspaper
CareApp,https://www.proquest.com/anznews/docview/2501202757/257FBCCED6094396PQ/4?accountid=14649,Free crack at gamified coding program in new SA institute,"Mar 14, 2021",Nationwide News Pty Ltd,Newspaper
CareApp,https://www.proquest.com/anznews/docview/2571522106/257FBCCED6094396PQ/5?accountid=14649,FEARLESS CONVERSATIONS l MEDICAL INNOVATION Cappuccino chat led to care app for elderly,"Sep 12, 2021",Nationwide News Pty Ltd,Newspaper
CareApp,https://www.proquest.com/anznews/docview/2570218848/257FBCCED6094396PQ/6?accountid=14649,Improving health of EDs,"Sep 9, 2021",Nationwide News Pty Ltd,Newspaper
CareApp,https://www.proquest.com/anznews/docview/2540606751/257FBCCED6094396PQ/7?accountid=14649,Tech students aim to crack the code,"Jun 15, 2021",Nationwide News Pty Ltd,Newspaper
CareApp,https://www.proquest.com/anznews/docview/2571521978/257FBCCED6094396PQ/8?accountid=14649,FEARLESS CONVERSATIONS l MEDICAL INNOVATION Big breakthroughs to keep us kicking,"Sep 12, 2021",Nationwide News Pty Ltd,Newspaper
CareApp,https://www.proquest.com/anznews/docview/2501174713/257FBCCED6094396PQ/9?accountid=14649,Students game for computer frontiers,"Mar 15, 2021",Nationwide News Pty Ltd,Newspaper
CareApp,https://www.proquest.com/anznews/docview/2569276464/257FBCCED6094396PQ/10?accountid=14649,FEARLESS CONVERSATIONS l MEDICAL INNOVATION Digital health for a lively future,"Sep 6, 2021",Nationwide News Pty Ltd,Newspaper
CareApp,https://www.proquest.com/anznews/docview/2569275797/257FBCCED6094396PQ/11?accountid=14649,FEARLESS CONVERSATIONS l MEDICAL INNOVATION Digital health for a lively future,"Sep 6, 2021",Nationwide News Pty Ltd,Newspaper
CareApp,https://www.proquest.com/anznews/docview/2139126582/257FBCCED6094396PQ/12?accountid=14649,Adelaide aged care app wins,"Nov 30, 2018",Nationwide News Pty Ltd,Newspaper
CareApp,https://www.proquest.com/anznews/docview/2226530847/257FBCCED6094396PQ/13?accountid=14649,SA’s leading lights gear up for Vogue tech talk,"May 18, 2019",Nationwide News Pty Ltd,Newspaper
CareApp,https://www.proquest.com/anznews/docview/2368530619/257FBCCED6094396PQ/14?accountid=14649,Bridging a gap for families and older Australians,"Mar 2, 2020",Fairfax Digital,Newspaper
CareApp,https://www.proquest.com/anznews/docview/1875148587/257FBCCED6094396PQ/15?accountid=14649,The best of care,"Feb 26, 2017",Nationwide News Pty Ltd,Newspaper
CareApp,https://www.proquest.com/anznews/docview/2295521231/257FBCCED6094396PQ/16?accountid=14649,Angels support SA aged care app,"Sep 24, 2019",Nationwide News Pty Ltd,Newspaper
CareApp,https://www.proquest.com/anznews/docview/2368532279/257FBCCED6094396PQ/17?accountid=14649,Bridging a gap for families and older Australians,"Mar 2, 2020",Fairfax Digital,Newspaper
CareApp,https://www.proquest.com/anznews/docview/2319214307/257FBCCED6094396PQ/18?accountid=14649,Stone & Chalk’s ambitious job creation plan,"Nov 29, 2019",Nationwide News Pty Ltd,Newspaper
CareApp,https://www.proquest.com/anznews/docview/2017643282/257FBCCED6094396PQ/19?accountid=14649,App keeps an eye on the elderly,"Mar 26, 2018",Nationwide News Pty Ltd,Newspaper
CareApp,https://www.proquest.com/anznews/docview/2017644740/257FBCCED6094396PQ/20?accountid=14649,App keeps an eye on the elderly,"Mar 26, 2018",Nationwide News Pty Ltd,Newspaper
CareApp,https://www.proquest.com/anznews/docview/2378086171/257FBCCED6094396PQ/21?accountid=14649,Restrictions placed on visits to aged care homes,"Mar 19, 2020",Nationwide News Pty Ltd,Newspaper
CareApp,https://www.proquest.com/anznews/docview/2418436618/257FBCCED6094396PQ/22?accountid=14649,An open line to family,"Jun 30, 2020",Nationwide News Pty Ltd,Newspaper
