tech,link,title,date_,publisher_,source_type_,business_index_term
artificial intelligence,https://www.proquest.com/anznews/docview/2261511993/38C549A391024716PQ/991?accountid=14649,Groupe FIVA buys stake in Kadego,"Jul 23, 2019",Nationwide News Pty Ltd,Newspaper,
artificial intelligence,https://www.proquest.com/anznews/docview/2407416885/38C549A391024716PQ/992?accountid=14649,$10m investment in future of education,"May 30, 2020",Nationwide News Pty Ltd,Newspaper,
artificial intelligence,https://www.proquest.com/anznews/docview/2274433922/38C549A391024716PQ/993?accountid=14649,Golden girl’s on a good wicket,"Aug 18, 2019",Nationwide News Pty Ltd,Newspaper,
artificial intelligence,https://www.proquest.com/anznews/docview/2278801641/38C549A391024716PQ/994?accountid=14649,Child sex dolls jail warning,"Aug 25, 2019",Nationwide News Pty Ltd,Newspaper,
artificial intelligence,https://www.proquest.com/anznews/docview/2355970331/38C549A391024716PQ/995?accountid=14649,Hi-tech partnership to support future frigates,"Feb 18, 2020",Nationwide News Pty Ltd,Newspaper,
artificial intelligence,https://www.proquest.com/anznews/docview/2300630337/38C549A391024716PQ/996?accountid=14649,Defence and health hub,"Oct 5, 2019",Nationwide News Pty Ltd,Newspaper,
artificial intelligence,https://www.proquest.com/anznews/docview/2385946141/38C549A391024716PQ/997?accountid=14649,SA LEADS VACCINE RACE,"Apr 4, 2020",Nationwide News Pty Ltd,Newspaper,
artificial intelligence,https://www.proquest.com/anznews/docview/2187316748/38C549A391024716PQ/998?accountid=14649,Change to vexed research project,"Mar 4, 2019",Nationwide News Pty Ltd,Newspaper,
artificial intelligence,https://www.proquest.com/anznews/docview/2187179445/38C549A391024716PQ/999?accountid=14649,Why machines are good money managers,"Mar 3, 2019",Nationwide News Pty Ltd,Newspaper,
artificial intelligence,https://www.proquest.com/anznews/docview/2423639769/38C549A391024716PQ/1001?accountid=14649,APP TO DATE,"Jul 15, 2020",Nationwide News Pty Ltd,Newspaper,
artificial intelligence,https://www.proquest.com/anznews/docview/2415563337/38C549A391024716PQ/1002?accountid=14649,CORE hub to help to unearth big ideas,"Jun 23, 2020",Nationwide News Pty Ltd,Newspaper,
artificial intelligence,https://www.proquest.com/anznews/docview/2230623915/38C549A391024716PQ/1003?accountid=14649,ADD YEARS TO YOUR SHELF LIFE,"May 25, 2019",Nationwide News Pty Ltd,Newspaper,
artificial intelligence,https://www.proquest.com/anznews/docview/2416024765/38C549A391024716PQ/1004?accountid=14649,Killer was ‘living in a simulation’,"Jun 24, 2020",Nationwide News Pty Ltd,Newspaper,
artificial intelligence,https://www.proquest.com/anznews/docview/2305501417/38C549A391024716PQ/1005?accountid=14649,THE REAL SKILLS IN DEMAND,"Oct 16, 2019",Nationwide News Pty Ltd,Newspaper,
artificial intelligence,https://www.proquest.com/anznews/docview/2344249326/38C549A391024716PQ/1006?accountid=14649,SA tech company’s shoebox spy in sky,"Jan 25, 2020",Nationwide News Pty Ltd,Newspaper,
artificial intelligence,https://www.proquest.com/anznews/docview/2303402512/38C549A391024716PQ/1007?accountid=14649,STATE OF THE HEART,"Oct 12, 2019",Nationwide News Pty Ltd,Newspaper,
artificial intelligence,https://www.proquest.com/anznews/docview/2431380957/38C549A391024716PQ/1008?accountid=14649,Want a visa? Speak bogan,"Aug 9, 2020",Nationwide News Pty Ltd,Newspaper,
artificial intelligence,https://www.proquest.com/anznews/docview/2399962766/38C549A391024716PQ/1009?accountid=14649,SETTING COMPASS FOR SUCCESS,"May 9, 2020",Nationwide News Pty Ltd,Newspaper,
artificial intelligence,https://www.proquest.com/anznews/docview/2216762927/38C549A391024716PQ/1010?accountid=14649,Can you do Tinder at 50?,"Apr 28, 2019",Nationwide News Pty Ltd,Newspaper,
artificial intelligence,https://www.proquest.com/anznews/docview/2267370157/38C549A391024716PQ/1011?accountid=14649,Tech revolution warning,"Aug 1, 2019",Nationwide News Pty Ltd,Newspaper,
artificial intelligence,https://www.proquest.com/anznews/docview/2452191851/38C549A391024716PQ/1012?accountid=14649,SA GREAT Hi-tech boost to back buy-SA bid,"Oct 21, 2020",Nationwide News Pty Ltd,Newspaper,['Digital marketing']
artificial intelligence,https://www.proquest.com/anznews/docview/2417172039/38C549A391024716PQ/1013?accountid=14649,STAYING IN,"Jun 27, 2020",Nationwide News Pty Ltd,Newspaper,
artificial intelligence,https://www.proquest.com/anznews/docview/2416027462/38C549A391024716PQ/1014?accountid=14649,Killer was ‘living in a simulation’,"Jun 24, 2020",Nationwide News Pty Ltd,Newspaper,
artificial intelligence,https://www.proquest.com/anznews/docview/2266364584/38C549A391024716PQ/1015?accountid=14649,Age-old fun – with a few worry lines,"Jul 19, 2019",Nationwide News Pty Ltd,Newspaper,
artificial intelligence,https://www.proquest.com/anznews/docview/2385752291/38C549A391024716PQ/1016?accountid=14649,SA LEADS VACCINE RACE,"Apr 4, 2020",Nationwide News Pty Ltd,Newspaper,
artificial intelligence,https://www.proquest.com/anznews/docview/2445693065/38C549A391024716PQ/1017?accountid=14649,You’re virtually driving,"Sep 25, 2020",Nationwide News Pty Ltd,Newspaper,
artificial intelligence,https://www.proquest.com/anznews/docview/2448016416/38C549A391024716PQ/1018?accountid=14649,TV DETECTIVE,"Oct 4, 2020",Nationwide News Pty Ltd,Newspaper,
artificial intelligence,https://www.proquest.com/anznews/docview/2310407552/38C549A391024716PQ/1019?accountid=14649,ACTION man who fights for FUTURE,"Oct 31, 2019",Nationwide News Pty Ltd,Newspaper,
artificial intelligence,https://www.proquest.com/anznews/docview/2164598204/38C549A391024716PQ/1020?accountid=14649,Have your say,"Jan 9, 2019",Nationwide News Pty Ltd,Newspaper,
artificial intelligence,https://www.proquest.com/anznews/docview/2205476800/38C549A391024716PQ/1021?accountid=14649,Have your say,"Apr 10, 2019",Nationwide News Pty Ltd,Newspaper,
artificial intelligence,https://www.proquest.com/anznews/docview/2433581766/38C549A391024716PQ/1022?accountid=14649,STAYING IN,"Aug 15, 2020",Nationwide News Pty Ltd,Newspaper,
artificial intelligence,https://www.proquest.com/anznews/docview/2393183308/38C549A391024716PQ/1023?accountid=14649,Amid this pandemic it’s a privilege to be bored,"Apr 23, 2020",Nationwide News Pty Ltd,Newspaper,
artificial intelligence,https://www.proquest.com/anznews/docview/2210077376/38C549A391024716PQ/1024?accountid=14649,Progress must never erode our empathy,"Apr 17, 2019",Nationwide News Pty Ltd,Newspaper,
artificial intelligence,https://www.proquest.com/anznews/docview/2165811967/38C549A391024716PQ/1025?accountid=14649,Making welfare system work better for all of us,"Jan 11, 2019",Nationwide News Pty Ltd,Newspaper,
artificial intelligence,https://www.proquest.com/anznews/docview/2165812025/38C549A391024716PQ/1026?accountid=14649,Making welfare system work better for all of us,"Jan 11, 2019",Nationwide News Pty Ltd,Newspaper,
artificial intelligence,https://www.proquest.com/anznews/docview/2165676265/38C549A391024716PQ/1027?accountid=14649,Making welfare system work better for all of us,"Jan 11, 2019",Nationwide News Pty Ltd,Newspaper,
artificial intelligence,https://www.proquest.com/anznews/docview/2187573421/38C549A391024716PQ/1028?accountid=14649,Putin the pressure on our elections,"Mar 1, 2019",Nationwide News Pty Ltd,Newspaper,
artificial intelligence,https://www.proquest.com/anznews/docview/2405426250/38C549A391024716PQ/1029?accountid=14649,Grumpy about so many old men,"May 23, 2020",Nationwide News Pty Ltd,Newspaper,
artificial intelligence,https://www.proquest.com/anznews/docview/2388044410/38C549A391024716PQ/1030?accountid=14649,STAYING IN,"Apr 11, 2020",Nationwide News Pty Ltd,Newspaper,
artificial intelligence,https://www.proquest.com/anznews/docview/2301123520/38C549A391024716PQ/1031?accountid=14649,Looking for love online,"Oct 7, 2019",Nationwide News Pty Ltd,Newspaper,
artificial intelligence,https://www.proquest.com/anznews/docview/2283209675/38C549A391024716PQ/1032?accountid=14649,Are home health tests worth your money?,"Sep 1, 2019",Nationwide News Pty Ltd,Newspaper,
artificial intelligence,https://www.proquest.com/anznews/docview/2332089839/38C549A391024716PQ/1033?accountid=14649,Balancing the books,"Jan 4, 2020",Nationwide News Pty Ltd,Newspaper,
artificial intelligence,https://www.proquest.com/anznews/docview/2193185739/38C549A391024716PQ/1034?accountid=14649,THE FUTURE OF HAIR,"Mar 17, 2019",Nationwide News Pty Ltd,Newspaper,
artificial intelligence,https://www.proquest.com/anznews/docview/2282416567/38C549A391024716PQ/1035?accountid=14649,Go with your gut feeling,"Aug 17, 2019",Nationwide News Pty Ltd,Newspaper,['Health care industry']
artificial intelligence,https://www.proquest.com/anznews/docview/2238637142/38C549A391024716PQ/1036?accountid=14649,A FUTURE THAT SADLY FADES FAST,"Jun 13, 2019",Nationwide News Pty Ltd,Newspaper,
artificial intelligence,https://www.proquest.com/anznews/docview/2389112053/38C549A391024716PQ/1037?accountid=14649,Virtual reality's crucial role in ag studies,"Apr 9, 2020",Fairfax Media Publications Pty Limited,Newspaper,
artificial intelligence,https://www.proquest.com/anznews/docview/2238150847/38C549A391024716PQ/1038?accountid=14649,Join knitting for love,"Jun 12, 2019",Fairfax Media Publications Pty Limited,Newspaper,
artificial intelligence,https://www.proquest.com/anznews/docview/2280028749/38C549A391024716PQ/1039?accountid=14649,New digital hub to improve home care,"Aug 27, 2019",Fairfax Media Publications Pty Limited,Newspaper,
artificial intelligence,https://www.proquest.com/anznews/docview/2388597500/38C549A391024716PQ/1040?accountid=14649,Time to dig out all your Digger pictures,"Apr 12, 2020",Nationwide News Pty Ltd,Newspaper,
artificial intelligence,https://www.proquest.com/anznews/docview/2689353861/38C549A391024716PQ/1041?accountid=14649,Media Release: Dopamine hits; Antarctic art; a mass rocket launch; and will we have enough prawns for Christmas?,"Jul 15, 2022",Australian Associated Press Pty Limited,Wire Feed,['Breweries']
artificial intelligence,https://www.proquest.com/anznews/docview/2389111558/38C549A391024716PQ/1042?accountid=14649,Teaching animal handling from the classroom,"Apr 9, 2020",Fairfax Media Publications Pty Limited,Newspaper,
artificial intelligence,https://www.proquest.com/anznews/docview/2444956459/38C549A391024716PQ/1043?accountid=14649,"Picture this, IVF results to lift","Sep 24, 2020",Fairfax Media Publications Pty Limited,Newspaper,
artificial intelligence,https://www.proquest.com/anznews/docview/2269055024/38C549A391024716PQ/1044?accountid=14649,Just Eat hails Menulog’s appetite for growth,"Aug 8, 2019",Nationwide News Pty Ltd,Newspaper,
artificial intelligence,https://www.proquest.com/anznews/docview/2244139082/38C549A391024716PQ/1045?accountid=14649,"Small local film, big global reach","Jun 22, 2019",Fairfax Digital,Newspaper,
artificial intelligence,https://www.proquest.com/anznews/docview/2407414464/38C549A391024716PQ/1046?accountid=14649,Surging banks add 15pc in four days,"May 29, 2020",Nationwide News Pty Ltd,Newspaper,
artificial intelligence,https://www.proquest.com/anznews/docview/2244135993/38C549A391024716PQ/1047?accountid=14649,inventive sci-fi thrills,"Jun 22, 2019",Fairfax Digital,Newspaper,
artificial intelligence,https://www.proquest.com/anznews/docview/2408918569/38C549A391024716PQ/1048?accountid=14649,New high-tech koala count begins on KI,"Jun 4, 2020",Fairfax Media Publications Pty Limited,Newspaper,
artificial intelligence,https://www.proquest.com/anznews/docview/2207153023/38C549A391024716PQ/1049?accountid=14649,"10 THINGS to see, hear & do this weekend","Apr 12, 2019",Fairfax Digital,Newspaper,
satellite technology,https://www.proquest.com/anznews/docview/2718727541/6F564745A9754A21PQ/1?accountid=14649,Space spending invests in quality of life on Earth,"Sep 29, 2022",Nationwide News Pty Ltd,Newspaper,
satellite technology,https://www.proquest.com/anznews/docview/2720608530/6F564745A9754A21PQ/2?accountid=14649,Satellite firm sets up at Lot Fourteen,"Oct 4, 2022",Nationwide News Pty Ltd,Newspaper,
satellite technology,https://www.proquest.com/anznews/docview/2664938581/6F564745A9754A21PQ/3?accountid=14649,Satellite selfie stick a weapon in space wars,"May 17, 2022",Nationwide News Pty Ltd,Newspaper,
satellite technology,https://www.proquest.com/anznews/docview/2664941337/6F564745A9754A21PQ/4?accountid=14649,Satellite selfie stick a weapon in space wars,"May 17, 2022",Nationwide News Pty Ltd,Newspaper,
satellite technology,https://www.proquest.com/anznews/docview/2727770126/6F564745A9754A21PQ/5?accountid=14649,Airbus shares control for Aussie space race,"Oct 25, 2022",Nationwide News Pty Ltd,Newspaper,"['Supply chains;', 'Engineering firms']"
satellite technology,https://www.proquest.com/anznews/docview/2556171354/6F564745A9754A21PQ/6?accountid=14649,Low-orbit satellite technology allows a new generation to find their place in space,"Jul 29, 2021",Nationwide News Pty Ltd,Newspaper,['Machine learning']
satellite technology,https://www.proquest.com/anznews/docview/2729233414/6F564745A9754A21PQ/7?accountid=14649,Exciting new build for Blackfriars,"Oct 29, 2022",Nationwide News Pty Ltd,Newspaper,
satellite technology,https://www.proquest.com/anznews/docview/2727491040/6F564745A9754A21PQ/8?accountid=14649,Moonshot: Airbus pitches to build sovereign space industry,"Oct 24, 2022",Nationwide News Pty Ltd,Newspaper,"['Supply chains;', 'Engineering firms']"
satellite technology,https://www.proquest.com/anznews/docview/2712256020/6F564745A9754A21PQ/9?accountid=14649,Submariner Mark Hammond rises to the challenge,"Sep 9, 2022",Nationwide News Pty Ltd,Newspaper,
satellite technology,https://www.proquest.com/anznews/docview/2712082283/6F564745A9754A21PQ/10?accountid=14649,SUBMARINER RISES TO THE CHALLENGE,"Sep 10, 2022",Nationwide News Pty Ltd,Newspaper,
satellite technology,https://www.proquest.com/anznews/docview/2523040105/6F564745A9754A21PQ/11?accountid=14649,"Price on carbon is the key, says Green Collar’s James Schultz","May 7, 2021",Nationwide News Pty Ltd,Newspaper,"['International relations;', 'Executives']"
satellite technology,https://www.proquest.com/anznews/docview/2624761614/6F564745A9754A21PQ/12?accountid=14649,The Advertiser Adelaide a launching pad for innovation,"Feb 3, 2022",Nationwide News Pty Ltd,Newspaper,
satellite technology,https://www.proquest.com/anznews/docview/2580192960/6F564745A9754A21PQ/13?accountid=14649,Space Week’s timely reminder,"Oct 8, 2021",Nationwide News Pty Ltd,Newspaper,
satellite technology,https://www.proquest.com/anznews/docview/2458201650/6F564745A9754A21PQ/14?accountid=14649,OUR PROSPECTUS,"Nov 7, 2020",Nationwide News Pty Ltd,Newspaper,['Cost of living']
satellite technology,https://www.proquest.com/anznews/docview/2476296275/6F564745A9754A21PQ/15?accountid=14649,Undischarged bankrupt David Catsoulis hoping to hit gold with new project,"Jan 8, 2021",Nationwide News Pty Ltd,Newspaper,
satellite technology,https://www.proquest.com/anznews/docview/2501882733/6F564745A9754A21PQ/16?accountid=14649,Rocket launch site deal in place,"Mar 18, 2021",Fairfax Media Publications Pty Limited,Newspaper,
satellite technology,https://www.proquest.com/anznews/docview/2500017733/6F564745A9754A21PQ/17?accountid=14649,Southern Launch finalises launchpad agreement,"Mar 12, 2021",Fairfax Media Publications Pty Limited,Newspaper,
satellite technology,https://www.proquest.com/anznews/docview/2595224290/6F564745A9754A21PQ/18?accountid=14649,Physics & Mathematics - Australia's research field leaders,"Nov 10, 2021",Nationwide News Pty Ltd,Newspaper,
satellite technology,https://www.proquest.com/anznews/docview/2533469632/6F564745A9754A21PQ/19?accountid=14649,"Know of Atlassian? Now watch for Complexica, Clipchamp, SafetyCulture & Canva","May 27, 2021",Nationwide News Pty Ltd,Newspaper,"['Startups;', 'Executives;', 'Value stocks']"
satellite technology,https://www.proquest.com/anznews/docview/2534508260/6F564745A9754A21PQ/20?accountid=14649,"Know of Atlassian? Now watch for Complexica, Clipchamp, SafetyCulture & Canva","May 30, 2021",Nationwide News Pty Ltd,Newspaper,"['Startups;', 'Executives;', 'Value stocks']"
satellite technology,https://www.proquest.com/anznews/docview/2634863933/6F564745A9754A21PQ/21?accountid=14649,Primary voices have say,"Mar 3, 2022",Fairfax Media Publications Pty Limited,Newspaper,"['Leases;', 'Workforce']"
satellite technology,https://www.proquest.com/anznews/docview/2564170425/6F564745A9754A21PQ/22?accountid=14649,Conference gets the green light,"Aug 26, 2021",Fairfax Media Publications Pty Limited,Newspaper,
satellite technology,https://www.proquest.com/anznews/docview/2562570387/6F564745A9754A21PQ/23?accountid=14649,AgTech conference gets green light,"Aug 20, 2021",Fairfax Media Publications Pty Limited,Newspaper,
satellite technology,https://www.proquest.com/anznews/docview/2548949350/6F564745A9754A21PQ/24?accountid=14649,Monitoring technology reduces water run times,"Jul 8, 2021",Fairfax Media Publications Pty Limited,Newspaper,
satellite technology,https://www.proquest.com/anznews/docview/2649753844/6F564745A9754A21PQ/25?accountid=14649,Getting water systems right,"Apr 14, 2022",Fairfax Media Publications Pty Limited,Newspaper,
satellite technology,https://www.proquest.com/anznews/docview/2581487704/6F564745A9754A21PQ/26?accountid=14649,Agtech event to drive SA industry forward,"Oct 14, 2021",Fairfax Media Publications Pty Limited,Newspaper,
satellite technology,https://www.proquest.com/anznews/docview/2549953531/6F564745A9754A21PQ/27?accountid=14649,Monitoring technology reduces water run times,"Jul 11, 2021",Fairfax Media Publications Pty Limited,Newspaper,
satellite technology,https://www.proquest.com/anznews/docview/2555223161/6F564745A9754A21PQ/28?accountid=14649,Protest over tower plans,"Jul 27, 2021",Nationwide News Pty Ltd,Newspaper,
satellite technology,https://www.proquest.com/anznews/docview/2555222348/6F564745A9754A21PQ/29?accountid=14649,Protest over tower plans,"Jul 27, 2021",Nationwide News Pty Ltd,Newspaper,
satellite technology,https://www.proquest.com/anznews/docview/2522953971/6F564745A9754A21PQ/30?accountid=14649,PRICE ON CARBON IS THE KEY,"May 8, 2021",Nationwide News Pty Ltd,Newspaper,"['International relations;', 'Executives']"
satellite technology,https://www.proquest.com/anznews/docview/2504588167/6F564745A9754A21PQ/31?accountid=14649,4K vision splendid,"Mar 25, 2021",Nationwide News Pty Ltd,Newspaper,
satellite technology,https://www.proquest.com/anznews/docview/2557136809/6F564745A9754A21PQ/32?accountid=14649,If people choose to opt out of the Covid-19 vaccination program they should face penalties – Rex Jory,"Aug 2, 2021",Nationwide News Pty Ltd,Newspaper,
satellite technology,https://www.proquest.com/anznews/docview/2557139836/6F564745A9754A21PQ/33?accountid=14649,If people choose to opt out of the Covid-19 vaccination program they should face penalties – Rex Jory,"Aug 2, 2021",Nationwide News Pty Ltd,Newspaper,
satellite technology,https://www.proquest.com/anznews/docview/2538801090/6F564745A9754A21PQ/34?accountid=14649,New GM canola withstands herbicides,"Jun 9, 2021",Nationwide News Pty Ltd,Newspaper,
satellite technology,https://www.proquest.com/anznews/docview/2472185011/6F564745A9754A21PQ/35?accountid=14649,Boost for disaster comms,"Dec 24, 2020",Fairfax Media Publications Pty Limited,Newspaper,
satellite technology,https://www.proquest.com/anznews/docview/2472184518/6F564745A9754A21PQ/36?accountid=14649,Boost for disaster comms,"Dec 24, 2020",Fairfax Media Publications Pty Limited,Newspaper,
satellite technology,https://www.proquest.com/anznews/docview/2540546077/6F564745A9754A21PQ/37?accountid=14649,Big push for rural and regional industries to adopt digital technologies,"Jun 15, 2021",Fairfax Media Publications Pty Limited,Newspaper,"['Machine learning;', 'Startups;', 'Performance management']"
satellite technology,https://www.proquest.com/anznews/docview/2540546065/6F564745A9754A21PQ/38?accountid=14649,Big push for rural and regional industries to adopt digital technologies,"Jun 15, 2021",Fairfax Media Publications Pty Limited,Newspaper,"['Machine learning;', 'Startups;', 'Performance management']"
satellite technology,https://www.proquest.com/anznews/docview/2519530086/6F564745A9754A21PQ/39?accountid=14649,Race is on for reliable robotic weapons,"Apr 30, 2021",Nationwide News Pty Ltd,Newspaper,['Defense industry']
satellite technology,https://www.proquest.com/anznews/docview/2551277852/6F564745A9754A21PQ/40?accountid=14649,Tried and trusted regrowth control,"Jul 15, 2021",Fairfax Media Publications Pty Limited,Newspaper,
satellite technology,https://www.proquest.com/anznews/docview/2476215592/6F564745A9754A21PQ/41?accountid=14649,A colourful character goes for gold,"Jan 9, 2021",Nationwide News Pty Ltd,Newspaper,
satellite technology,https://www.proquest.com/anznews/docview/2284172906/6F564745A9754A21PQ/42?accountid=14649,City with the Lot Fourteen,"Sep 5, 2019",Nationwide News Pty Ltd,Newspaper,
satellite technology,https://www.proquest.com/anznews/docview/2284160854/6F564745A9754A21PQ/43?accountid=14649,City with the Lot Fourteen,"Sep 5, 2019",Nationwide News Pty Ltd,Newspaper,
satellite technology,https://www.proquest.com/anznews/docview/2379654279/6F564745A9754A21PQ/44?accountid=14649,SOUTH AUSTRALIA LIFTS OFF,"Mar 22, 2020",Nationwide News Pty Ltd,Newspaper,
satellite technology,https://www.proquest.com/anznews/docview/2299436770/6F564745A9754A21PQ/45?accountid=14649,Space hub coup for uni,"Oct 1, 2019",Nationwide News Pty Ltd,Newspaper,
satellite technology,https://www.proquest.com/anznews/docview/2299483483/6F564745A9754A21PQ/46?accountid=14649,Space hub coup for uni,"Oct 1, 2019",Nationwide News Pty Ltd,Newspaper,
satellite technology,https://www.proquest.com/anznews/docview/2230852419/6F564745A9754A21PQ/47?accountid=14649,Reinvention of defence science,"May 29, 2019",Nationwide News Pty Ltd,Newspaper,
satellite technology,https://www.proquest.com/anznews/docview/2408329173/6F564745A9754A21PQ/48?accountid=14649,Satellite tech has space to grow,"Jun 2, 2020",Nationwide News Pty Ltd,Newspaper,
satellite technology,https://www.proquest.com/anznews/docview/2345514415/6F564745A9754A21PQ/49?accountid=14649,Satellites will put us on front foot fighting fires,"Jan 28, 2020",Nationwide News Pty Ltd,Newspaper,
satellite technology,https://www.proquest.com/anznews/docview/2345517293/6F564745A9754A21PQ/51?accountid=14649,Technology set to help fight fires from orbit,"Jan 28, 2020",Nationwide News Pty Ltd,Newspaper,
satellite technology,https://www.proquest.com/anznews/docview/2268181858/6F564745A9754A21PQ/52?accountid=14649,Climate’s right for farming revolution,"Aug 4, 2019",Nationwide News Pty Ltd,Newspaper,
satellite technology,https://www.proquest.com/anznews/docview/2268081118/6F564745A9754A21PQ/53?accountid=14649,Climate’s right for farming revolution,"Aug 4, 2019",Nationwide News Pty Ltd,Newspaper,
satellite technology,https://www.proquest.com/anznews/docview/2344932866/6F564745A9754A21PQ/54?accountid=14649,New tech to join in fire fight,"Jan 27, 2020",Nationwide News Pty Ltd,Newspaper,
satellite technology,https://www.proquest.com/anznews/docview/2210555020/6F564745A9754A21PQ/55?accountid=14649,Net gains from orbiting ‘toasters’,"Apr 18, 2019",Nationwide News Pty Ltd,Newspaper,
satellite technology,https://www.proquest.com/anznews/docview/2284205789/6F564745A9754A21PQ/56?accountid=14649,"Water watchdog racks up convictions, inspections in first year","Sep 5, 2019",Fairfax Media Publications Pty Limited,Newspaper,
satellite technology,https://www.proquest.com/anznews/docview/2273984465/6F564745A9754A21PQ/57?accountid=14649,State-uni partnership drives dryland ag research forward,"Aug 17, 2019",Fairfax Media Publications Pty Limited,Newspaper,
satellite technology,https://www.proquest.com/anznews/docview/2343007382/6F564745A9754A21PQ/58?accountid=14649,Telcos move to raise network fire defences: Disaster Resilience,"Jan 23, 2020",Fairfax Digital,Newspaper,
satellite technology,https://www.proquest.com/anznews/docview/2364268241/6F564745A9754A21PQ/59?accountid=14649,Help of the highest Calibre,"Feb 27, 2020",Fairfax Media Publications Pty Limited,Newspaper,
satellite technology,https://www.proquest.com/anznews/docview/2184202518/6F564745A9754A21PQ/60?accountid=14649,Cheaper satellites unlock space,"Feb 22, 2019",Nationwide News Pty Ltd,Newspaper,
satellite technology,https://www.proquest.com/anznews/docview/2230849768/6F564745A9754A21PQ/61?accountid=14649,Defence tips $1.3bn into science-technology ‘arms’ race,"May 29, 2019",Nationwide News Pty Ltd,Newspaper,
satellite technology,https://www.proquest.com/anznews/docview/2644792529/6F564745A9754A21PQ/62?accountid=14649,We're using lasers and toaster-sized satellites to beam information faster through space,"Dec 6, 2019",Athena Information Solutions Pvt. Ltd.,Newspaper,
satellite technology,https://www.proquest.com/anznews/docview/2176351851/6F564745A9754A21PQ/63?accountid=14649,Myriota partners with Davey,"Feb 7, 2019",Fairfax Media Publications Pty Limited,Newspaper,
satellite technology,https://www.proquest.com/anznews/docview/2201796981/6F564745A9754A21PQ/64?accountid=14649,SA’s big slice of pie in the sky,"Apr 3, 2019",Nationwide News Pty Ltd,Newspaper,
satellite technology,https://www.proquest.com/anznews/docview/2331881379/6F564745A9754A21PQ/65?accountid=14649,Have your say,"Jan 3, 2020",Nationwide News Pty Ltd,Newspaper,
satellite technology,https://www.proquest.com/anznews/docview/2429332850/6F564745A9754A21PQ/66?accountid=14649,READY FOR BLAST-OFF,"Aug 1, 2020",Nationwide News Pty Ltd,Newspaper,
satellite technology,https://www.proquest.com/anznews/docview/2258961588/6F564745A9754A21PQ/67?accountid=14649,Precision agriculture adoption on the up,"Jul 18, 2019",Fairfax Media Publications Pty Limited,Newspaper,
