tech,link,title,date_,publisher_,source_type_,business_index_term
smart technology,https://www.proquest.com/anznews/docview/2185577975/3EA0831FA5F349E0PQ/79?accountid=14649,A coastal home to suit your needs – whatever they are,"Feb 23, 2019",Nationwide News Pty Ltd,Newspaper,
smart technology,https://www.proquest.com/anznews/docview/2454447234/3EA0831FA5F349E0PQ/80?accountid=14649,RAA urges state govt to commit funding to road upgrades,"Oct 28, 2020",Fairfax Media Publications Pty Limited,Newspaper,['State budgets']
smart technology,https://www.proquest.com/anznews/docview/2319786373/3EA0831FA5F349E0PQ/81?accountid=14649,Latest tech boosts yields,"Dec 1, 2019",Fairfax Media Publications Pty Limited,Newspaper,
smart technology,https://www.proquest.com/anznews/docview/2301555765/3EA0831FA5F349E0PQ/82?accountid=14649,3-D cameras predict optimum slaughter,"Oct 8, 2019",Fairfax Media Publications Pty Limited,Newspaper,
smart technology,https://www.proquest.com/anznews/docview/2221465140/3EA0831FA5F349E0PQ/83?accountid=14649,Critical issues discussed,"May 9, 2019",Fairfax Media Publications Pty Limited,Newspaper,
smart technology,https://www.proquest.com/anznews/docview/2222780898/3EA0831FA5F349E0PQ/84?accountid=14649,Grey candidates discuss critical issues,"May 11, 2019",Fairfax Media Publications Pty Limited,Newspaper,
smart technology,https://www.proquest.com/anznews/docview/2373647777/3EA0831FA5F349E0PQ/85?accountid=14649,SA Water supply cuts are longest in country,"Mar 9, 2020",Nationwide News Pty Ltd,Newspaper,
smart technology,https://www.proquest.com/anznews/docview/2439742496/3EA0831FA5F349E0PQ/86?accountid=14649,Free solar for homes,"Sep 4, 2020",Nationwide News Pty Ltd,Newspaper,['Energy industry']
smart technology,https://www.proquest.com/anznews/docview/2373643222/3EA0831FA5F349E0PQ/87?accountid=14649,SA Water supply cuts are longest in country,"Mar 9, 2020",Nationwide News Pty Ltd,Newspaper,
smart technology,https://www.proquest.com/anznews/docview/2439742690/3EA0831FA5F349E0PQ/88?accountid=14649,Free solar for homes,"Sep 4, 2020",Nationwide News Pty Ltd,Newspaper,['Energy industry']
smart technology,https://www.proquest.com/anznews/docview/2206338215/3EA0831FA5F349E0PQ/89?accountid=14649,Marion’s $1.7m smart zone,"Apr 11, 2019",Nationwide News Pty Ltd,Newspaper,
smart technology,https://www.proquest.com/anznews/docview/2365711227/3EA0831FA5F349E0PQ/90?accountid=14649,Incentive for change running out,"Feb 29, 2020",Nationwide News Pty Ltd,Newspaper,
smart technology,https://www.proquest.com/anznews/docview/2210558648/3EA0831FA5F349E0PQ/91?accountid=14649,Island’s wild cats in the firing line,"Apr 18, 2019",Nationwide News Pty Ltd,Newspaper,
smart technology,https://www.proquest.com/anznews/docview/2271770079/3EA0831FA5F349E0PQ/92?accountid=14649,Is it time to upgrade your airconditioning? Home improvement | Special promotions,"Aug 11, 2019",Nationwide News Pty Ltd,Newspaper,
smart technology,https://www.proquest.com/anznews/docview/2322392883/3EA0831FA5F349E0PQ/93?accountid=14649,Smarter way to save on power,"Dec 7, 2019",Nationwide News Pty Ltd,Newspaper,
smart technology,https://www.proquest.com/anznews/docview/2325334644/3EA0831FA5F349E0PQ/94?accountid=14649,Get ready for a scorcher,"Dec 15, 2019",Nationwide News Pty Ltd,Newspaper,
smart technology,https://www.proquest.com/anznews/docview/2351519032/3EA0831FA5F349E0PQ/95?accountid=14649,Not in the mood for this,"Feb 7, 2020",Nationwide News Pty Ltd,Newspaper,
smart technology,https://www.proquest.com/anznews/docview/2344249326/3EA0831FA5F349E0PQ/96?accountid=14649,SA tech company’s shoebox spy in sky,"Jan 25, 2020",Nationwide News Pty Ltd,Newspaper,
smart technology,https://www.proquest.com/anznews/docview/2322147222/3EA0831FA5F349E0PQ/97?accountid=14649,Smarter way to save on power,"Dec 7, 2019",Nationwide News Pty Ltd,Newspaper,
smart technology,https://www.proquest.com/anznews/docview/2294071771/3EA0831FA5F349E0PQ/98?accountid=14649,Why we are switching on to smarter houses,"Sep 21, 2019",Nationwide News Pty Ltd,Newspaper,
smart technology,https://www.proquest.com/anznews/docview/2424555361/3EA0831FA5F349E0PQ/99?accountid=14649,A good foundation,"Jul 19, 2020",Nationwide News Pty Ltd,Newspaper,
smart technology,https://www.proquest.com/anznews/docview/2260593512/3EA0831FA5F349E0PQ/101?accountid=14649,No face tracing cameras: Mayor,"Jul 22, 2019",Nationwide News Pty Ltd,Newspaper,
smart technology,https://www.proquest.com/anznews/docview/2322912563/3EA0831FA5F349E0PQ/102?accountid=14649,Learning how to make straw pay,"Dec 5, 2019",Fairfax Media Publications Pty Limited,Newspaper,
smart technology,https://www.proquest.com/anznews/docview/2295624284/3EA0831FA5F349E0PQ/103?accountid=14649,"Think big, move fast: University of Newcastle Vice-Chancellor Alex Zelinsky to give keynote innovation speech","Sep 24, 2019",Fairfax Digital,Newspaper,
smart technology,https://www.proquest.com/anznews/docview/2411178934/3EA0831FA5F349E0PQ/104?accountid=14649,Wharf gets $7.5 million upgrade,"Jun 11, 2020",Fairfax Media Publications Pty Limited,Newspaper,
smart technology,https://www.proquest.com/anznews/docview/2387057272/3EA0831FA5F349E0PQ/105?accountid=14649,Technology presents new set of domestic violence concerns,"Apr 8, 2020",Fairfax Media Publications Pty Limited,Newspaper,
smart technology,https://www.proquest.com/anznews/docview/2486550403/3EA0831FA5F349E0PQ/106?accountid=14649,Media Release: Storing excess solar from the grid using hot water systems,"Feb 5, 2021",Australian Associated Press Pty Limited,Wire Feed,
smart technology,https://www.proquest.com/anznews/docview/2206736562/3EA0831FA5F349E0PQ/107?accountid=14649,SA to trial cameras in nursing homes,"Apr 11, 2019",Australian Associated Press Pty Limited,Wire Feed,
smart home technology,https://www.proquest.com/anznews/docview/2708842834/2D1872DC44AB4BB5PQ/1?accountid=14649,error 404 :),error 404 :),error 404 :),error 404 :),error 404 :)
smart home technology,https://www.proquest.com/anznews/docview/2468857886/2D1872DC44AB4BB5PQ/2?accountid=14649,"New mega Bunnings the biggest in WA, brings state and nation ‘firsts’","Dec 10, 2020",Nationwide News Pty Ltd,Newspaper,
smart home technology,https://www.proquest.com/anznews/docview/2461083205/2D1872DC44AB4BB5PQ/3?accountid=14649,Smart speakers to boom,"Nov 18, 2020",Nationwide News Pty Ltd,Newspaper,
smart home technology,https://www.proquest.com/anznews/docview/2490805163/2D1872DC44AB4BB5PQ/4?accountid=14649,How we make working from home work for us,"Feb 20, 2021",Nationwide News Pty Ltd,Newspaper,"['Automation;', 'Virtual offices']"
smart home technology,https://www.proquest.com/anznews/docview/2610990168/2D1872DC44AB4BB5PQ/5?accountid=14649,Retirement renovation,"Dec 18, 2021",Nationwide News Pty Ltd,Newspaper,
smart home technology,https://www.proquest.com/anznews/docview/2466102232/2D1872DC44AB4BB5PQ/6?accountid=14649,Presents of mind,"Dec 4, 2020",Nationwide News Pty Ltd,Newspaper,"['Gifts;', 'Customers']"
smart home technology,https://www.proquest.com/anznews/docview/2623149361/2D1872DC44AB4BB5PQ/7?accountid=14649,The Fixer,"Jan 29, 2022",Nationwide News Pty Ltd,Newspaper,"['Architecture;', 'Automation']"
smart home technology,https://www.proquest.com/anznews/docview/2488097662/2D1872DC44AB4BB5PQ/8?accountid=14649,How to make your home smarter,"Feb 11, 2021",Nationwide News Pty Ltd,Newspaper,['Smartphones']
smart home technology,https://www.proquest.com/anznews/docview/2610587830/2D1872DC44AB4BB5PQ/9?accountid=14649,Green goes mainstream,"Dec 18, 2021",Nationwide News Pty Ltd,Newspaper,"['Smartphones;', 'Automation']"
smart home technology,https://www.proquest.com/anznews/docview/2260000566/2D1872DC44AB4BB5PQ/10?accountid=14649,60 disability-focused homes to be built across state,"Jul 20, 2019",Nationwide News Pty Ltd,Newspaper,
smart home technology,https://www.proquest.com/anznews/docview/2728277709/2D1872DC44AB4BB5PQ/11?accountid=14649,Media Release: Getting smart on climate change: why Aussie homes are missing the mark,"Oct 26, 2022",Australian Associated Press Pty Limited,Wire Feed,"['Automation;', 'Cost control']"
smart home technology,https://www.proquest.com/anznews/docview/2303805892/2D1872DC44AB4BB5PQ/12?accountid=14649,Bunnings tools up as it targets tradies market,"Oct 12, 2019",Nationwide News Pty Ltd,Newspaper,
smart home technology,https://www.proquest.com/anznews/docview/2303797201/2D1872DC44AB4BB5PQ/13?accountid=14649,Bunnings tools up as it targets tradies market,"Oct 12, 2019",Nationwide News Pty Ltd,Newspaper,
smart home technology,https://www.proquest.com/anznews/docview/2424813049/2D1872DC44AB4BB5PQ/14?accountid=14649,Smart-home hack attacks,"Jul 20, 2020",Nationwide News Pty Ltd,Newspaper,
smart home technology,https://www.proquest.com/anznews/docview/2424813295/2D1872DC44AB4BB5PQ/15?accountid=14649,Smart-home hack attacks,"Jul 20, 2020",Nationwide News Pty Ltd,Newspaper,
smart home technology,https://www.proquest.com/anznews/docview/2376358822/2D1872DC44AB4BB5PQ/16?accountid=14649,Family stunner built to entertain,"Mar 14, 2020",Nationwide News Pty Ltd,Newspaper,
smart home technology,https://www.proquest.com/anznews/docview/2383242687/2D1872DC44AB4BB5PQ/17?accountid=14649,Dream homes,"Mar 28, 2020",Nationwide News Pty Ltd,Newspaper,
smart home technology,https://www.proquest.com/anznews/docview/2424813149/2D1872DC44AB4BB5PQ/18?accountid=14649,Glitches open door to smart home hackers,"Jul 20, 2020",Nationwide News Pty Ltd,Newspaper,
smart home technology,https://www.proquest.com/anznews/docview/2424813279/2D1872DC44AB4BB5PQ/19?accountid=14649,Glitches open door to smart home hackers,"Jul 20, 2020",Nationwide News Pty Ltd,Newspaper,
smart home technology,https://www.proquest.com/anznews/docview/2222663748/2D1872DC44AB4BB5PQ/20?accountid=14649,Tech a selling point for apartments: Smart homes,"May 11, 2019",Fairfax Digital,Newspaper,['Automation']
blockchain,https://www.proquest.com/anznews/docview/2659374689/6735ACB617574C29PQ/1?accountid=14649,Anywhere workers,"May 5, 2022",Nationwide News Pty Ltd,Newspaper,"['Blockchain;', 'Workers']"
blockchain,https://www.proquest.com/anznews/docview/2680636456/6735ACB617574C29PQ/2?accountid=14649,Bank on crypto? It’s a big gamble,"Jun 26, 2022",Nationwide News Pty Ltd,Newspaper,"['Digital currencies;', 'Blockchain;', 'Social networks']"
blockchain,https://www.proquest.com/anznews/docview/2701972005/6735ACB617574C29PQ/3?accountid=14649,"ON YOUR MARK, GET SET, GROW","Aug 14, 2022",Nationwide News Pty Ltd,Newspaper,"['Digital currencies;', 'Blockchain;', 'Artificial intelligence;', 'Startups;', 'Supermarkets;', 'Venture capital']"
blockchain,https://www.proquest.com/anznews/docview/2701595416/6735ACB617574C29PQ/4?accountid=14649,"ON YOUR MARK, GET SET, GROW","Aug 14, 2022",Nationwide News Pty Ltd,Newspaper,"['Digital currencies;', 'Artificial intelligence;', 'Startups;', 'Employees;', 'Supermarkets;', 'Venture capital']"
blockchain,https://www.proquest.com/anznews/docview/2701648947/6735ACB617574C29PQ/5?accountid=14649,"ON YOUR MARK, GET SET, GROW","Aug 14, 2022",Nationwide News Pty Ltd,Newspaper,"['Digital currencies;', 'Artificial intelligence;', 'Startups;', 'Employees;', 'Supermarkets;', 'Venture capital']"
blockchain,https://www.proquest.com/anznews/docview/2701967890/6735ACB617574C29PQ/6?accountid=14649,"ON YOUR MARK, GET SET – GROW","Aug 14, 2022",Nationwide News Pty Ltd,Newspaper,"['Digital currencies;', 'Artificial intelligence;', 'Startups;', 'Employees;', 'Supermarkets;', 'Venture capital']"
blockchain,https://www.proquest.com/anznews/docview/2708328082/6735ACB617574C29PQ/7?accountid=14649,Caring for our farmers,"Sep 1, 2022",Fairfax Media Publications Pty Limited,Newspaper,"['Supply chains;', 'Free trade;', 'Trade agreements;', 'Dairy industry;', 'Value chain']"
blockchain,https://www.proquest.com/anznews/docview/2689363533/6735ACB617574C29PQ/8?accountid=14649,THE LIST,"Jul 15, 2022",Nationwide News Pty Ltd,Newspaper,"['Careers;', 'Startups;', 'Venture capital']"
blockchain,https://www.proquest.com/anznews/docview/2728287289/6735ACB617574C29PQ/9?accountid=14649,BPS ‘misrepresented’ usefulness of Qoin,"Oct 26, 2022",Nationwide News Pty Ltd,Newspaper,
blockchain,https://www.proquest.com/anznews/docview/2673434791/6735ACB617574C29PQ/10?accountid=14649,"Crikey, this zoo has crypto crocs","Jun 7, 2022",Nationwide News Pty Ltd,Newspaper,
blockchain,https://www.proquest.com/anznews/docview/2689358990/6735ACB617574C29PQ/11?accountid=14649,"Regulate crypto like other products, FPA","Jul 15, 2022",Nationwide News Pty Ltd,Newspaper,
blockchain,https://www.proquest.com/anznews/docview/2659375347/6735ACB617574C29PQ/12?accountid=14649,Australia Zoo’s huge NFT deal,"May 5, 2022",Nationwide News Pty Ltd,Newspaper,
blockchain,https://www.proquest.com/anznews/docview/2673698152/6735ACB617574C29PQ/13?accountid=14649,Is cryptocurrency such as Bitcoin losing its will to live?,"Jun 8, 2022",Nationwide News Pty Ltd,Newspaper,['Digital currencies']
blockchain,https://www.proquest.com/anznews/docview/2709188239/6735ACB617574C29PQ/14?accountid=14649,Golden age on horizon for Australia’s $3bn sports technology industry,"Sep 3, 2022",Nationwide News Pty Ltd,Newspaper,
blockchain,https://www.proquest.com/anznews/docview/2669825401/6735ACB617574C29PQ/15?accountid=14649,There are systems 'guarding' your data in cyberspace – but who is guarding the guards?,"May 27, 2022",Athena Information Solutions Pvt. Ltd.,Newspaper,
blockchain,https://www.proquest.com/anznews/docview/2461592529/6735ACB617574C29PQ/16?accountid=14649,Wine benefits from hi-tech skills,"Nov 11, 2020",Nationwide News Pty Ltd,Newspaper,"['Machine learning;', 'Blockchain;', 'Consumers;', 'Wineries & vineyards']"
blockchain,https://www.proquest.com/anznews/docview/2459463639/6735ACB617574C29PQ/17?accountid=14649,Wine benefits from hi-tech skills,"Nov 12, 2020",Nationwide News Pty Ltd,Newspaper,"['Machine learning;', 'Blockchain;', 'Consumers;', 'Wineries & vineyards']"
blockchain,https://www.proquest.com/anznews/docview/2480618828/6735ACB617574C29PQ/18?accountid=14649,From online trading to blockchain Kerry Roxburgh retains passion for technology,"Jan 25, 2021",Nationwide News Pty Ltd,Newspaper,"['Stock exchanges;', 'Blockchain;', 'Accounting;', 'Banking']"
blockchain,https://www.proquest.com/anznews/docview/2543333852/6735ACB617574C29PQ/19?accountid=14649,Footy stars John Aloisi and Eddie Betts headline Australian crypto NFT launch,"Jun 20, 2021",Nationwide News Pty Ltd,Newspaper,"['Digital currencies;', 'Blockchain']"
blockchain,https://www.proquest.com/anznews/docview/2557218507/6735ACB617574C29PQ/20?accountid=14649,On Campus blog: Daily news updates from the tertiary education sector,"Aug 1, 2021",Nationwide News Pty Ltd,Newspaper,['Blockchain']
blockchain,https://www.proquest.com/anznews/docview/2490805197/6735ACB617574C29PQ/21?accountid=14649,THE LAST WORD,"Feb 19, 2021",Nationwide News Pty Ltd,Newspaper,['Blockchain']
blockchain,https://www.proquest.com/anznews/docview/2469397290/6735ACB617574C29PQ/22?accountid=14649,RECORDING THE FUTURE,"Dec 13, 2020",Nationwide News Pty Ltd,Newspaper,"['Smartphones;', 'Wineries & vineyards']"
blockchain,https://www.proquest.com/anznews/docview/2563148374/6735ACB617574C29PQ/23?accountid=14649,Andrew Forrest’s PR play in battle for Huon,"Aug 20, 2021",Nationwide News Pty Ltd,Newspaper,['Executives']
blockchain,https://www.proquest.com/anznews/docview/2537582409/6735ACB617574C29PQ/24?accountid=14649,On Campus blog: Daily news updates from the tertiary education sector,"Jun 6, 2021",Nationwide News Pty Ltd,Newspaper,['Coal industry']
blockchain,https://www.proquest.com/anznews/docview/2484652724/6735ACB617574C29PQ/25?accountid=14649,Pension funds line up to back bid for Link’s $1bn Pexa stake,"Feb 1, 2021",Nationwide News Pty Ltd,Newspaper,"['Pension funds;', 'Infrastructure;', 'Equity funds']"
blockchain,https://www.proquest.com/anznews/docview/2469964468/6735ACB617574C29PQ/26?accountid=14649,Devil in the retail clients for JBWere,"Dec 14, 2020",Nationwide News Pty Ltd,Newspaper,
blockchain,https://www.proquest.com/anznews/docview/2601912456/6735ACB617574C29PQ/27?accountid=14649,Fintech top of the chain for City of London Lord Mayor Vincent Keaveny,"Nov 24, 2021",Nationwide News Pty Ltd,Newspaper,"['Trade agreements;', 'EU membership;', 'Bank technology;', 'Financial services;', 'Employment;', 'Banking']"
blockchain,https://www.proquest.com/anznews/docview/2580771583/6735ACB617574C29PQ/28?accountid=14649,Crypto group wind-up bid,"Oct 12, 2021",Nationwide News Pty Ltd,Newspaper,"['Digital currencies;', 'Blockchain']"
blockchain,https://www.proquest.com/anznews/docview/2584410978/6735ACB617574C29PQ/29?accountid=14649,‘UNICORN’ IS FIRST PAST POST IN VIRTUAL RACING,"Oct 23, 2021",Nationwide News Pty Ltd,Newspaper,['Blockchain']
blockchain,https://www.proquest.com/anznews/docview/2606245448/6735ACB617574C29PQ/30?accountid=14649,Crypto crooks ransack Bitcoin – in plain sight,"Dec 5, 2021",Nationwide News Pty Ltd,Newspaper,"['Digital currencies;', 'Blockchain']"
blockchain,https://www.proquest.com/anznews/docview/2635313124/6735ACB617574C29PQ/31?accountid=14649,"CRYPTOCURRENCY, NFTS AND THE METAVERSE EXPLAINED","Mar 4, 2022",Nationwide News Pty Ltd,Newspaper,"['Digital currencies;', 'Blockchain;', 'Currency']"
blockchain,https://www.proquest.com/anznews/docview/2549002401/6735ACB617574C29PQ/32?accountid=14649,NAB joins pilot plan on carbon,"Jul 8, 2021",Nationwide News Pty Ltd,Newspaper,['Blockchain']
blockchain,https://www.proquest.com/anznews/docview/2647440361/6735ACB617574C29PQ/33?accountid=14649,Digital payday,"Apr 7, 2022",Nationwide News Pty Ltd,Newspaper,"['Blockchain;', 'Job openings']"
blockchain,https://www.proquest.com/anznews/docview/2618120009/6735ACB617574C29PQ/34?accountid=14649,Cryptocurrency 101,"Jan 10, 2022",Nationwide News Pty Ltd,Newspaper,"['Digital currencies;', 'Blockchain;', 'Currency;', 'Central banks;', 'Investment policy']"
blockchain,https://www.proquest.com/anznews/docview/2619027476/6735ACB617574C29PQ/35?accountid=14649,Crypto unlocks value for Aussie farmers,"Jan 13, 2022",Nationwide News Pty Ltd,Newspaper,"['Digital currencies;', 'Blockchain;', 'Currency;', 'Agribusiness']"
blockchain,https://www.proquest.com/anznews/docview/2543222176/6735ACB617574C29PQ/36?accountid=14649,Betts in bitcoin auction,"Jun 21, 2021",Nationwide News Pty Ltd,Newspaper,"['Digital currencies;', 'Blockchain']"
blockchain,https://www.proquest.com/anznews/docview/2635299869/6735ACB617574C29PQ/37?accountid=14649,"CRYPTOCURRENCY, NFTS AND THE METAVERSE EXPLAINED","Mar 4, 2022",Nationwide News Pty Ltd,Newspaper,"['Digital currencies;', 'Blockchain;', 'Currency']"
blockchain,https://www.proquest.com/anznews/docview/2543209467/6735ACB617574C29PQ/38?accountid=14649,Betts in bitcoin auction,"Jun 21, 2021",Nationwide News Pty Ltd,Newspaper,"['Digital currencies;', 'Blockchain']"
blockchain,https://www.proquest.com/anznews/docview/2532345302/6735ACB617574C29PQ/39?accountid=14649,Money talk made easy,"May 27, 2021",Nationwide News Pty Ltd,Newspaper,"['Digital currencies;', 'Blockchain;', 'Banking']"
blockchain,https://www.proquest.com/anznews/docview/2543215064/6735ACB617574C29PQ/40?accountid=14649,Footy stars to kick off crypto NFT showcase,"Jun 21, 2021",Nationwide News Pty Ltd,Newspaper,"['Digital currencies;', 'Blockchain']"
blockchain,https://www.proquest.com/anznews/docview/2653395143/6735ACB617574C29PQ/41?accountid=14649,All too easy: crypto ETFs a risky lure,"Apr 23, 2022",Nationwide News Pty Ltd,Newspaper,"['Digital currencies;', 'Blockchain;', 'Superannuation']"
blockchain,https://www.proquest.com/anznews/docview/2609213754/6735ACB617574C29PQ/42?accountid=14649,"$16m penthouse at Queensgate, Potts Point, sold off the plan","Dec 12, 2021",Nationwide News Pty Ltd,Newspaper,"['Architecture;', 'Hotels & motels']"
blockchain,https://www.proquest.com/anznews/docview/2642550797/6735ACB617574C29PQ/43?accountid=14649,THE LIST - AUSTRALIA'S RICHEST 250,"Mar 25, 2022",Nationwide News Pty Ltd,Newspaper,"['Hedge funds;', 'Mezzanine financing;', 'Private equity;', 'Corporate profits;', 'Financial services']"
blockchain,https://www.proquest.com/anznews/docview/2563012616/6735ACB617574C29PQ/44?accountid=14649,Fish fight has Twiggy in a spin,"Aug 21, 2021",Nationwide News Pty Ltd,Newspaper,['Executives']
blockchain,https://www.proquest.com/anznews/docview/2632259265/6735ACB617574C29PQ/45?accountid=14649,THE LIST - THE POWER PLAYERS,"Feb 25, 2022",Nationwide News Pty Ltd,Newspaper,"['Meat industry;', 'Private equity']"
blockchain,https://www.proquest.com/anznews/docview/2456530410/6735ACB617574C29PQ/46?accountid=14649,New plan to tap hi-tech growth,"Nov 3, 2020",Nationwide News Pty Ltd,Newspaper,
blockchain,https://www.proquest.com/anznews/docview/2616089410/6735ACB617574C29PQ/47?accountid=14649,Students go digital with free courses,"Jan 4, 2022",Nationwide News Pty Ltd,Newspaper,
blockchain,https://www.proquest.com/anznews/docview/2542120149/6735ACB617574C29PQ/48?accountid=14649,BARRON'S TOP 100 FINANCIAL ADVISERS 2021 - Steve Triantafilidis,"Jun 18, 2021",Nationwide News Pty Ltd,Newspaper,"['Asset allocation;', 'Private equity;', 'Wealth management;', 'Superannuation;', 'Asset management;', 'Portfolio management']"
blockchain,https://www.proquest.com/anznews/docview/2645188316/6735ACB617574C29PQ/49?accountid=14649,Administrators aim to fulfil EP farm machinery orders,"Mar 31, 2022",Fairfax Media Publications Pty Limited,Newspaper,['Insolvency']
blockchain,https://www.proquest.com/anznews/docview/2504511922/6735ACB617574C29PQ/51?accountid=14649,Value grids still a way off: JBS,"Mar 25, 2021",Fairfax Media Publications Pty Limited,Newspaper,
blockchain,https://www.proquest.com/anznews/docview/2572604340/6735ACB617574C29PQ/52?accountid=14649,Tech trial to test modern milk traceability system,"Sep 16, 2021",Fairfax Media Publications Pty Limited,Newspaper,"['Supply chains;', 'Consumers;', 'Dairy industry']"
blockchain,https://www.proquest.com/anznews/docview/2456898934/6735ACB617574C29PQ/53?accountid=14649,Recycled water a treat for tomatoes,"Nov 4, 2020",Fairfax Media Publications Pty Limited,Newspaper,
blockchain,https://www.proquest.com/anznews/docview/2504512392/6735ACB617574C29PQ/54?accountid=14649,Value grids still a way off: JBS,"Mar 25, 2021",Fairfax Media Publications Pty Limited,Newspaper,
blockchain,https://www.proquest.com/anznews/docview/2574760294/6735ACB617574C29PQ/55?accountid=14649,Trial to test milk traceability system,"Sep 19, 2021",Fairfax Media Publications Pty Limited,Newspaper,"['Supply chains;', 'Consumers;', 'Dairy industry']"
blockchain,https://www.proquest.com/anznews/docview/2645188194/6735ACB617574C29PQ/56?accountid=14649,Administrators aim to fulfil EP farm machinery orders,"Mar 31, 2022",Fairfax Media Publications Pty Limited,Newspaper,['Insolvency']
blockchain,https://www.proquest.com/anznews/docview/2495519367/6735ACB617574C29PQ/57?accountid=14649,Dairy's list of wishes being met,"Mar 4, 2021",Fairfax Media Publications Pty Limited,Newspaper,"['Trade agreements;', 'Dairy industry;', 'Free trade']"
blockchain,https://www.proquest.com/anznews/docview/2496373242/6735ACB617574C29PQ/58?accountid=14649,Summit continues to guide future of SA dairy,"Mar 5, 2021",Fairfax Media Publications Pty Limited,Newspaper,"['Consumers;', 'Succession planning;', 'Dairy industry']"
blockchain,https://www.proquest.com/anznews/docview/2466066786/6735ACB617574C29PQ/59?accountid=14649,Significant change to benefit all,"Dec 3, 2020",Fairfax Media Publications Pty Limited,Newspaper,['Dairy industry']
blockchain,https://www.proquest.com/anznews/docview/2574726578/6735ACB617574C29PQ/60?accountid=14649,E-trade continues to elude wool sector,"Sep 20, 2021",Fairfax Media Publications Pty Limited,Newspaper,"['Supply chains;', 'Sales;', 'Market prices;', 'Wool industry']"
blockchain,https://www.proquest.com/anznews/docview/2542217997/6735ACB617574C29PQ/61?accountid=14649,"Top 100 Financial Advisers: Steve Triantafilidis, executive director and financial adviser, Morgan Stanley Wealth Management","Jun 17, 2021",Nationwide News Pty Ltd,Newspaper,"['Asset allocation;', 'Private equity;', 'Wealth management;', 'Superannuation;', 'Asset management;', 'Portfolio management']"
blockchain,https://www.proquest.com/anznews/docview/2635313172/6735ACB617574C29PQ/62?accountid=14649,MAKING A MOTZA IN METAVERSE,"Mar 4, 2022",Nationwide News Pty Ltd,Newspaper,"['Digital currencies;', 'Social networks']"
blockchain,https://www.proquest.com/anznews/docview/2556513798/6735ACB617574C29PQ/63?accountid=14649,It’s getting very arty-farty as Beeple Crap pumps out the non-fungible tokens,"Jul 30, 2021",Nationwide News Pty Ltd,Newspaper,
blockchain,https://www.proquest.com/anznews/docview/2556517705/6735ACB617574C29PQ/64?accountid=14649,It’s getting very arty-farty as Beeple Crap pumps out the non-fungible tokens,"Jul 31, 2021",Nationwide News Pty Ltd,Newspaper,
blockchain,https://www.proquest.com/anznews/docview/2635298705/6735ACB617574C29PQ/65?accountid=14649,MAKING A MOTZA IN METAVERSE,"Mar 4, 2022",Nationwide News Pty Ltd,Newspaper,"['Digital currencies;', 'Social networks']"
blockchain,https://www.proquest.com/anznews/docview/2599222949/6735ACB617574C29PQ/66?accountid=14649,Penfolds pops cork on digital tokens,"Nov 20, 2021",Nationwide News Pty Ltd,Newspaper,
blockchain,https://www.proquest.com/anznews/docview/2474956769/6735ACB617574C29PQ/67?accountid=14649,"Bitcoin surges, tipped to reach $US100,000","Jan 5, 2021",Nationwide News Pty Ltd,Newspaper,"['Digital currencies;', 'Currency']"
blockchain,https://www.proquest.com/anznews/docview/2607029772/6735ACB617574C29PQ/68?accountid=14649,"20,000 hit in crypto collapse","Dec 7, 2021",Nationwide News Pty Ltd,Newspaper,"['Digital currencies;', 'Bank technology']"
